id,Category,_Term,Description
1394,Exicon,Not-So Lazy Boys,"On your six sitting upright with your legs straight out in front of you. Cross your arms and grab your sides, leaning back in your ""Lazy Boy"" as far as you can without your feet coming off the ground. Hold and engage your core for 10-15 seconds and rotate to your right, dropping your right elbow towards the ground (not letting it touch the ground), back to the middle (hold for 10-15 seconds, core still engaged) and then rotate over to your left, dropping your left elbow towards the ground (not letting it touch the ground). Do this for as long as you'd like..on the Q's lead and count!"
1395,Exicon,Nutcracker,"With a  brick in each hand held overhead, perform a lunge. At the same time, lower the arms and bring the bricks together between the legs. Return to the standing position, raising the bricks back overhead."
1396,Exicon,O.P.P.,"You down with O.P.P? Yeah you know me! Whose down with O.P.P? All of F3! Partner up. Partner 1 does Overhead Claps while in People's Chair (O.P.). Meanwhile Partner 2 does a set number of Plank Jacks (P.) Switch. Can do multiple rounds, swapping out the Plank Jacks for Peter Parkers or Parker Peters or any exercise that starts with P."
1397,Exicon,O3,"Objective, Operation(s), Out.  Used as part of a ruck or run work out.   Run or ruck to the 'objective'.  At the objective, execute the operation (DORA, Heartbreak, beatdown, Q's choice), then 'Out' (return to the starting point/AO) expeditiously.  If rucking, pace should be less than 4 mph with 35 lb. ruck for most.  The entire operation performed with ruck is preferable. Coupons welcome/encouraged."
1398,Exicon,Obama,"In honor of the 44th POTUS, this traveling exercise consists primarily of a Bear Crawl, but after every 4 hand moves PAX must stop and perform 4 Merkins. (The 4 and 4 for the 44th, in case you needed that explained to you...)"
1399,Exicon,Old Flame Drill (OFD),These 4 runner specific excercises done in sequence. runner's squat> scorpions>bulgarian split squat> bridges. All excercises done single leg 10 per leg (or more). Search youtube for a demonstration of these exercises.
1400,Exicon,Old Town Pain Train,"Every time you hear the train whistle, 10 burpees. Named for the AO in Rock Hill closest to the RR tracks."
1401,Exicon,Ollie Norths,Heaving a man over your back to carry him from the battlefield.  Then carry him for a while. (f/k/a First Responders)
1402,Exicon,One Calls,"This is an 8-count IC exercise developed as a result of the sometimes horrible merkin form by some PAX, especially those claiming to do great #’s when in fact they didn’t do any correctly. It was a way to force the PAX to have FULL extension both at the bottom and the top, which only makes them better (and stops the improper form). Since I work with OneCall and he would come to the office daily to complain about this, I developed this exercise and named it after him for my upcoming Q. Start in Merkin/Plank position. 1 – Down; 2 – Hand Release; 3 – Up and hold; 4 – Floyd Mayweather Punch Right arm; 5 – Right arm down; 6 – Floyd Mayweather Punch Left arm; 7 – Left arm down; 8 (which would be the PAX count of 1, 2, 3, etc) – Full plank. As you can see, this forces the PAX to go all the way down instead of the 1-2” down that some claim count as a merkin, and it forces a locking of the elbows at the top. 10-15 of these are excellent. It has also been done with 2 PAX facing each other and keeping each other honest (Q choice with these to make the Floyd Mayweathers into Booyah Merkins or Slap 5's or anything like that where the PAX are mirroring each other)."
1403,Exicon,One-armed Pickle Pounder with Coupon,"Start with one arm on the ground in pickle pounder position, the other hand has the coupon (in Jacksonville we use a milk jug filled with water apxt. 8lbs) Hold the coupon on the small of your back with the free hand during reps x20 in cadence, switch arms and repeat."
1404,Exicon,One-legged Burpee,"Not enough exercises start with ""O"" so... the one-legged burpee is like a regular burpee, but with one leg that stays off the ground through the entire set. Best to do two balanced sets or one split set so you don't look like a #Yepremian."
1405,Exicon,Outlaw,"Sitting in the position for flutter kicks, keep your feet together and make a big ""O"" with them. 10 reps to the right and 10 reps to the left or as many reps as the Q deems necessary."
1406,Exicon,Over The Shoulder Boulder Holder,"It's a six-count movement with a coupon (rock, cinderblock, etc.).  Starting position is standing, holding coupon near waist.  1. Curl coupon up to shoulders. 2. Extend arms straight up as in overhead press.  3. Lower coupon behind head.  4. Return to arms extended overhead. 5. Return back to shoulder height.  6. Lower curl back to starting position."
1407,Exicon,OYO,"On Your Own, as opposed to together (in cadence)."
1408,Exicon,Painkillers,"Start with a Man-Maker ,then add a double merkin  and plank jacks to it"
1409,Exicon,Pamela Anderson,Burpee with a nipple scraper merkin (with or without a curb). Performance in slow motion while in a bathing suit is purely optional!
1410,Exicon,Pansey,"Conduct pull up. While up, lift the legs to the 90 degree position or beyond. lower legs to perpendicular to the ground. Lower body to the down position. Repeat."
1411,Exicon,PAPPs (Partner Assisted Pickle Pounders),Partner Up. Partner 1 assumes the plank position while Partner 2 grabs his ankles and brings them to waist height. Partner 2 begins doing Curls for the Girls while Partner 1 maintains plank position. Typically done OYO but can be done in cadence. Usually performed 15-20 at a time. Then switch positions. Rinse and repeat for a good time
1412,Exicon,Parking Space Tracer,"For those participating in an AO with a parking lot, PAX starts at one point on a parking space line. PAX runs/sidesteps/runs backward while tracing the lines on the parking lot. Even better when double sided / open spaces."
1413,Exicon,Partner Carry,Carry a partner either in a fireman hold or simply on your back some distance that Q calls out.
1414,Exicon,Partner Derkin,Merkin performed with your feet up on your planking partner's back.
1415,Exicon,Partner Plank Curls,Partner up. One partner gets in plank position. The other partner stands directly behind him and grabs planked partner's ankles and does bicep curls. Make sure partner in plank position keeps legs together.
1416,Exicon,Partner Shrug,Partner #1 assumes the plank position. Partner #2 grabs partner #1 by the ankles and commences shoulder shrug exercise using Partner #1 as weight. Flapjack and repeat.
1417,Exicon,Pattycake Merkin,"Two partners face each other in plank position and perform merkin together. On up movement, partners touch right hands in the middle. Repeat merkin and switch hands."
1418,Exicon,Paula Abdul,"Any set in which you take 2 steps forward and then 1 step back and continue to do so until you reach a defined endpoint. For example: run up 2 ramps of a parking deck, perform an exercise, run down 1 ramp, perform an exercise, continue until you reach the top. Also works well with parking lot lines, speed bumps, light posts, flights of stairs, etc."
1419,Exicon,Peeping Lipstick,"A combination of a Turkish Getup and Star Jump.  PAX performs the Turkish Getup and then immediately performs 1 Star Jump.  The transition between TG and SJ should be done fluidly.   This exercise name comes from the combination of 2 PAX names, ""Peeping Tom"" (who loves Turkish Getups) and ""Lipstick"" (who loves Star Jumps), who were once working out together as Co-Qs and decided to combine the two movements.  The name Turkish Getup Star Jumps is just way too long to say."
1420,Exicon,Pendulum,"Works great at the base of two hills (paved hill w/ some distance is optimal but any hill works) going up either side (a valley of sorts), but can be done on one hill as well.  Starting at the base, do 10 seal jacks then head up the hill.  At the top, do 11 burpees, then head back down, stopping for 10 seal jacks each time you reach the base.  Head up the other side (or same hill if you don't have two hills) and do 11 hand release merkins at the top, before heading back down again (get the pendulum motion??).  On the down, you do 10 seal jacks (every time you pass the base) and head back up the first hill, stopping to do 10 burpees before seal jacks, and then 10 hand release on the other side.  Repeat until you reach 1 burpee and 1 hand release.  Results = hilly miles, 66 burpees, 66 hand release merkins, 110 seal jacks"
1421,Exicon,People's Air Presses,"While squatting in the People's Chair, perform overhead air presses."
1422,Exicon,People's Chair,Sitting against a wall with knees bent at a 90-degree angle for a period of time TBD by the workout leader. 
1423,Exicon,People's Chair Modification,"Things to distract your mind while in the Peoples Chair - Overhead presses, holding arms horizontal, left and right punches, left or right leg off the ground, and wall/thigh/chest slaps."
1424,Exicon,Pete Rose,"Defined as anytime a PAX feels need to dive head first across a finish line, end line, to Shovelflag or wherever a head first slide is deemed appropriate, as only Charlie Hustle would do it."
1425,Exicon,Peter Parker (and Parker Peter),"In plank position move left knee toward left elbow with foot flared out.. then flapjack. You should look like Spider-Man climbing a wall. For Parker-Peter, simply pull left knee across your body to the right elbow. For an added twist Peter-Parkers can be combined with Merkins, so that when you go down you bring your leg in, and then straighten the leg as you return to plank."
1426,Exicon,Peter Parker Peter,"Done just like a Peter-Parker or Parker-Peter, but you do both on one leg before switching to other leg. On count 1, Right Leg goes up into Peter-Parker, 2 it comes back, then same leg goes into Parker-Peter on 3, then back on the count, then do the same with left leg."
1427,Exicon,Piano Tappers,"Standing position, feet wider than shoulders. 4 count stretch: 1 touch right toe, 2 touch ground in center of body, 3 touch left toe 4: raise upper body to straight. Repeat as many times as necessary then reverse (go left to right)"
1428,Exicon,Pickle Dragger,"Begin in elbow plank, shift hips from side to side, in cadence.  Best performed after the pickle is already pounded."
1429,Exicon,Pickle Grinders,"Find a bench, box or low wall where Partner A lays face down over the edge of said device with the edge at hip level or slightly lower. Partner B holds Partner A's legs firmly down. Partner A drops torso below device and reverses to tight hold with back arched upward. Exercise name becomes evident very quickly with fast adjustments. Great with a modest coupon."
1430,Exicon,Pickle Pointer,"Take the already-disturbing Pickle Pounder and turn it on it's...er, rear. Begin on your six, then alternate hip thrusts up and down in cadence. Be sure to hold those glutes and abs tights as you point that pickle to the stars! As with the Pounder, the Pointer is best performed in front of store windows or in quiet neighborhoods."
1431,Exicon,Pickle Pounder,Begin in an elbow plank then alternate hip flexion and extension in cadence. Best performed in front of store windows or in quiet neighborhoods.
1432,Exicon,Pinocchio,"Pax circle up, get on their 6 with heads facing toward the circle, shoulder to shoulder. Q passes out two 40lbs sandbags on opposite sides of circle and instructs the Pax starts passing the bags…Pax reacts gleefully saying, “Is that it?”…then Q institutes a Low Slow Flutter AMRAP, then Freddy Mercury…Pax call Q a liar, just like Pinocchio."
1433,Exicon,Pinochle,"Each PAX pickes a card from the pinochle deck. The card values represent the reps and the suit represented the exercise.  9 = x9, 10 = x10, Jack = x11, Queen = x12, King = x13, Ace = x20, Game instruction card = Dealers Choice x50  Hearts = Merkins Diamonds = Burpees Spades = Squats Clubs = American Hammers"
1434,Exicon,Pistol Squats,"One legged squats. Extend right leg out front. Lower and keep right leg extended out, then raise back up. Flapjack. Takes balance. Can be done in front of a pole for balance help. Demo here: https://www.youtube.com/watch?v=8tqKpdY7_vE"
1435,Exicon,Piston,"Starting in standing position and a Block/Coupon on the ground at your feet, squat and pick up block and return to standing position with it. Then perform a squat and place the block to it's original position and return to original standing position w/out the block. Uncoordinated pax 9most everyone) will eventually get out of sync thereby looking like the pistons of that ""See-Thru"" engine block you see at the car parts store."
1436,Exicon,Plank Compass,"From plank position, Q calls out direction such as 90 degrees right or 180 degrees left. Pax rotates accordingly, walking hand over hand to the location designated by the Q (staying in plank), with toes acting as the center of the compass (stationary), and hands and head moving around the arc of the circle. Mix in Merkins at each stop. Do as many rotations as you like."
1437,Exicon,Plank Destroyer,"All the fun you can have with a Plank, mashed up into one exercise. Begin in Plank position, perform a Makhtar N'Diaye ending back in Plank position, perform a Merkin, perform alternating Shoulder Taps, perform a Plank Jack. That's one rep. Ideal entry in a sequence of low-rep exercises."
1438,Exicon,Plank Dips,"Steamer's M introduced him to plank dips and he brought them to PowderKeg. It can be done from regular plank or elbow plank position. From plank rotate your hips down to the ground on each side. 1 left, 2 regular, 3 right, regular for cadence count."
1439,Exicon,Plank Fonda,"Side plank, arm extended (on elbow to modify), lift upper leg in Jane Fonda motion, switch sides and repeat. Done in candence... with enthusiasm..."
1440,Exicon,Plank Hurdles,"Done on a football field. In small groups of 5-6, everyone starts in the plank position in the end zone. 1st man from each group sprints to the 10 and planks, 2nd sprints, hurdles him, planks on the 20, 3rd man hurdles each, planks on the 30, etc. At the end of the group, 1st man sprints, hurdles everyone, etc. Everyone should finish in a plank in the opposite end zone."
1441,Exicon,Plank Jacks,Jumping Jacks while in the plank position.
1442,Exicon,Plankorama,A routine; any kind of plank strung together until TBQ.
1443,Exicon,Plank-O-Rama,"Find a hill to be close by. Perform 10 of the following exercises: Merkin, Plank Kicks IC, Alt Shoulder Taps IC, Plank Jacks IC, Mountain Climbers IC. Goal is to do 3 rounds in a row that run up a hill and back down. repeat as many of the 3 round plank hold as possible."
1444,Exicon,Plankorama-mama,This is a series of exercises that alternate between plank position and seated position with no rest between. Ex. Hydraulics x 20 IC/LBCs x 20 IC/Shoulder taps x 20....etc. The name derives from a couple of AOs that have begun to shorten 6 minutes of mary to 6mom and then into momma.
1445,Exicon,Play it Cool,"This is meant for those 5:30 AM workouts where there aren't many cars driving by (but some). Anytime some sees a car drive by, they shout ""Play it cool!"" and you stop what you're doing and hold a squat while pretending to read the paper. Once the car leaves, you resume what you were doing."
1446,Exicon,Poker Chips,"Moving an 8x8x16 concrete block forward one parking pace at a time, shifting right/left and moving the next chip/block forward. At the last chip, cycle back to the front of the line. Exercise goes the length of parking lot or until the PAX yields."
1447,Exicon,Pole Dancing,"Lay on your 6 under a handrail, parallel to the rail, grab rail with both hands and pull yourself up alternating sides. For extra effort, wrap your legs around the rail."
1448,Exicon,Pony Express,"The PAX AMRAP an exercise. Ie: Mountain Climbers. 1 man leaves PAX, runs for 5 seconds. Performs 5 Merkins. Runs for 5 seconds more. Performs 5 Merkins etc. up to a total of 5 sets of 5 Merkins (25 reps). At completion, he continues AMRAP Mountain Climbers while he waits for the rest of the PAX. 2nd man follows 1st man after he clears the first station. 3rd man follows 2nd after he clears first station etc."
1449,Exicon,Ponzi Pinch,Air squat with a calf-raise at the top.  This move was done during a 2019 Q by Ponzi and had to leave in the middle to locate a safe place which was a pine tree.  Using his undershorts as paper he discarded and returned to lead his Q. Following the beatdown he quickly realized his car keys were missing and had to return to the scene of the crime where he found them next to yesterda y.
1450,Exicon,Pop-up Merkining aka Jiminy Cricket.,Merkin in which a powerful push from arms and toes causes all fours to leave the ground to complete the upward motion. Resembles a hopping cricket and inspires #respect for its bug-sized athleticism.
1451,Exicon,Post Hole Diggers,"Using your log, pole, post, etc. (Fault Line has two-man poles) stand it on its end and squat and lift using your legs, shoulders and arms to lift the pole until your arms are extended over head. Then reverse the upper body portion to bring the pole down. That's one rep! This is a great full body exercise when done correctly."
1452,Exicon,Power Merkin,"Merkin performed with your planking partner's feet up on your back. The bigger your partner, the more power required to complete the merkin."
1453,Exicon,Prayer Squat,"A body-weight squat performed with hands clasped in front of your chest. Just like a goblet squat with a dumbbell, just without the dumbbell."
1454,Exicon,Pretzel Crunch,"Start on your six with legs bent, heels on the ground. Lift your left leg and put your left foot on your right knee. Put your left arm out straight and your right arm bent behind your head. In cadence, bring right elbow to left knee, then back down. Flapjack and repeato."
1455,Exicon,Pretzel Stick,"Similar to the pretzel crunch, but more painful. This time start on your six with legs straight out and cross one foot onto the opposite knee. Upper body same as pretzel crunch. When you lift for the crunch move, raise both upper and lower body so that you are again trying to bring one elbow to the opposite knee. Flapjack and repeato. This one hurts!"
1456,Exicon,Prime Time Merkin,"Standard merkin position EXCEPT one leg up, toe off the ground.  As PAX are pushing up, switch legs on each rep (in a plyometric fashion).  Named after Neon Deion Sanders, and his celebratory shuffle to the end zone on breakaway runs."
1457,Exicon,Princess Tea Party,"PAX grab a partner and form two rows with partners facing each other in plank position. Partners do Pattycake Merkins for set number of reps, followed by a Partner People's Chair (Back to back wall sit) for set time. Rinse and repeat as necessary."
1458,Exicon,Prisindian Run aka Prisoner Indian Run,"Standard Indian Run, but with your hands behind your head and elbows out in the ""peacock position"". Great mumble chatter reducer!"
1459,Exicon,Prisoner Cell Merkin Burpees aka PCMBs.,"Drop to Plank, do 1 Merkin then bring your right knee in and back, do 1 Merkin then bring your left knee in and back, do 1 Merkin then bring both feet in and jump up = 1 PCMB complete. Try 10 of these. You'll wish you stopped at 5."
1460,Exicon,Prisoner's Squat,Body-weight squat performed with hands on your head or laced behind your head.
1461,Exicon,Protractor,"While on six, Q calls out various angles to hold legs at, such as 10, 30, 45, 90 degrees. Regular way is to hold legs together but Q may call split or 3 dimensional where legs are held at the angle called but apart."
1462,Exicon,Proud Mary,"Performed to ""Proud Mary"" by Creedence Clearwater Revival. Perform Big Boy Situps until “Rolling”, switch to Gas Pumps for each ""Rolling"", then to Flutter kick after ""Rolling"", then back to Gas Pumps during ""Rolling"", then back to Big Boy Situps. Repeat til song ends."
1463,Exicon,Pseudo Planche Merkins,Start in standard push-up position turning you hands until your fingers point to the toes. Next walk your feet up until you feel you are about to teeter over. Hands are as close to the belly as you can get. Perform 'Mericans. Great Bicep exercise. https://www.youtube.com/watch?v=C-SML6xnVkI
1464,Exicon,Pullerama,A pull-up routine of no specific composition.
1465,Exicon,Pull-up Squats,"Do one pull-up. Drop down, squat once, then repeat. (Thanks Tiny Dancer in Swamp Rabbit.)"
1466,Exicon,Pump Jack,"Pax pair up and get in plank position.  The Q chooses a number of merkins (we use 5) per set.  Pax 1 does 5 merkins while pax 2  planks, then switch.  Continue alternating merkins and planking until one pax in the pair reaches merkin failure.  After failure each pair gets up and lunge walks in circles around the other pax pairs until the last team reaches failure.  The pairs must encourage and push each other and then encourage others while lunge walking.  Last team to fail wins.  Named pump jack because all the pax going up and down during merkins looks like a field full of oil wells with  pump jacks, and you are pumped when it is over. Proper merkin form must be used by all.  With an uneven number of pax the Q does merkins on his own."
1467,Exicon,Punch-up Merkin,"In typical Merkin postion go down and back up, then punch straight out, to the side, or up (for a real burn) 10 times with right arm. Do another merkin and repeat with left arm. Best done OYO or during a circuit routine."
1468,Exicon,Puppy Humpers,"Very much like the Monkey Humpers but instead of holding your ankles, lift your coupon up off the ground and hold it suspended between your legs.  Commence with the motion as you would with a Monkey Humper."
1469,Exicon,Pure BURN,"1. Face a wall, fence....anything that you can hold onto; 2. Get in the squat position 3/4 up while holding the fence; 3. On the balls of your feet (tip toes); 4. Pulse 3/4 down to 1/2 (90 degrees) X 10; 5. Pulse 1/2 all the way down X10. Repeat until PAX complains... it wont take long."
1470,Exicon,Purple Pain,Any workout coordinated to Prince classic hits. Example: Cream (Dips and Dollys)  When Doves Cry (Curls & LBCs)  Raspberry Beret (Overhead Press & Outlaws)  I Would Die 4 U (Skullcrushers & Scissor Kicks)
1471,Exicon,Purse Snatcher,Pax swings coupon through the legs. Similar to a kettlebell swing.
1472,Exicon,Pusherama,"A chest routine of no specific composition, done to TBQ."
1473,Exicon,PVC Merkins,"Get 10' of 4"" PVC from your nearby hardware store.  Cut it into 8"" pieces.  For the exercise, with the PVC in your right hand do a Merkins, roll to your left and do a Merkin, roll back to your right, and rinse and repeat as desired.  They'll sneak up on you if you're not careful."
1474,Exicon,Quadraphilia,"Find a steep hill (Hill of pain). Set a timer, i.e. 4 minutes. Run forward down the hill and run backwards up the hill repeato until the timer runs out."
1475,Exicon,Quarter Pounder,"Done on a Football field or a large parking lot. Sprint to the 25 yards and Do 25 merkins, Run backwards to Goal And Sprint to the 50 and do 50 squats, Backwards to Goal Line sprint to the 75 and do 75 Mountain Climbers, Run backwards to the goal line and sprint to the hundred and do 100 SSH. mix and match exercises for the reps. Do it with a Bricks for a Quarter Pounder with cheese. Rinse and repeat for a Double Quarter Pounder."
1476,Exicon,Racoon Crawl,Narrow-grip crawl done along the top of a short wall or stadium bench.
1477,Exicon,Railroad Tracks,"The twisted sister of the Indian Run. Pax start in single file line. First pax drops to low plank, second pax jumps over first pax runs 5 yards and gets in low plank. Third pax jumps over both pax runs 5 yards and gets in low plank. After all pax have gone, the first pax jumps over all the pax and returns to low plank. This is continued until the destination is reached. The name derived from the pax looking like Railroad ties as you continuously hop over one another."
1478,Exicon,Railroaders,"One or more railroad ties needed. Split into 2-3 people per group. Each group takes turns on the railroad ties. 1st Round - Each group performs 20 overhead presses, while everyone else planks. 2nd Round - Each group performs 20 curls, while everyone else holds Al Gore. 3rd Round - Each group performs 20 dips, while everyone else performs flutter kicks. 4th Round - Each group performs 20 bent over rows, while everyone else lunges. Rinse & repeat as needed or change out exercises and reps as needed."
1479,Exicon,Rampage,"Performed at nearest hill or stairs. Starting at top, perform exercise of choice with X amount of reps. Once complete, bear crawl down the hill/stairs. At bottom, perform exercise of choice with X amount of reps. Once complete, crawl bear up the hill/stairs to the top. Down/up = 1 round. No limits on Q's choice of rounds."
1480,Exicon,Randorama,A series of completely unrelated and seemingly disjointed exercises done at an exhaustively rapid pace.
1481,Exicon,Randys,"You've seen A Christmas story, poor Randy can't put his arms down. With arms straight out but with face palms down, move arms up and down 6 to 12 inches in cadence. Best used following Moroccan night clubs or similar shoulder exercise i.e. overhead claps, Jack Webb's."
1482,Exicon,Ranger Merkins,"Merkin position - however, your hands should be placed back more in line with your rib cage instead of your shoulders."
1483,Exicon,Rapid Fire Rock Set,"Grab exercise rock. Exercises done in civilian cadence with Q calling up or down and PAX calling number. Do exercise to predetermined number (15 or 20 is good). No rest between sets. Example is curl, tri extension, overhead press done twice. Can follow press with overhead hold."
