id,Category,_Term,Description
870,Exicon,Beep Test/Highlander,"PAX run continuously between two points that are 20 meters apart from side to side. The runs are synchronized with a smart phone application that played beeps at set intervals. At the sound of a beep, the PAX run 20 meters before then next beep sounds As the test proceeds, the interval between each successive beep decreases, forcing the PAX to increase their speed over the course of the test, until it is impossible to keep in sync with the recording. Should the Pax fail to make the 20 meter distance prior to the sounding of the Beep, then the PAX are eliminated from the test. Any eliminated PAX do exercises previously designated by the “Q” until only 1 PAX remains doing the Bleep Test."
871,Exicon,Belching,"Pax lays flat on then ground in a line, Q says go. Everyone hops up similar to recovering from a burpee, and sprints 5 - 10 steps, then dives down flat on the ground remaining in line. Essentially, you're advancing the field without the enemy fire being able to smoke you. Go hard, go quick. After getting to your resting place, complete upper, and core routines, then do a different upper, core routine, then belch back to the starting point, mission accomplished. Best on grassy fields in the gloom with some morning dew, some dives have slides, one must reverse low crawl to get back to the line or forward low crawl to advance to the line."
872,Exicon,Bent Jacob,Any deviation from a straight #JacobsLadder.
873,Exicon,Berkins,"Doing merkins using bricks, best when including squats and jumpups."
874,Exicon,Bernie Sanders,Find the tallest hill you can and traverse it from bottom to top while running backwards. You'll find the quads you never had and all the while feeling the BERN. Repeat as necessary.
875,Exicon,Between the hedges,A merkin performed between a coupon and a curb.
876,Exicon,Bibliotheca Boogie,ct. Exercise Left Lunge Recover Right Lunge Recover Squat Down Recover
877,Exicon,Bibliotheca Burpee,24ct. Exercise  Squat Down Hands to Ground Shoot Feet out into plank position  Lower chest to ground Push chest away from ground Bring feet back underneath hips Stand up Left lunge Recover  Squat Down Hands to Ground Shoot Feet out into plank position  Lower chest to ground Push chest away from ground Bring feet back underneath hips Stand up Right lunge Recover Squat Down Hands to Ground Shoot Feet out into plank position  Lower chest to ground Push chest away from ground Bring feet back underneath hips Stand up Squat down Recover
878,Exicon,Big Bang,"PAX form small circle, everyone in a plank, shoulder-to-shoulder. Place headlamp in the center. Q calls out a number and exercise. For example, ""10 burpees,"" means PAX stand up in an explosion of energy, run directly away from center of circle 10 yards/paces and do 10 burpees, then run back to the center and plank for the 6. Each PAX must find their own route away from the center of circle. Obstacles--ditches, trees, pits--are encouraged, but next round can't start until all PAX accounted for. Generally performed in increasing counts (10 paces/reps, 20 paces/reps, 30 paces/reps, 40 paces/reps, 50 paces/reps) representing the ever-expanding universe."
879,Exicon,"Big Boy Sit-up-Ups (aka, Bissyous)",Big Boy Sit-up-Ups = standard Big Boy Sit-ups + stand all the way up when you get to the top of each sit up position... helps to have a Partner holding your feet. Recommended Partner holding feet keep head down chin to chest - avoid strange encounters to the face during exercise!
880,Exicon,Big Diesel,Block exercise where you Murder Bunny forward immediately followed by a block shoulder press and finished with a block burpee. Completed over a pre-determined distance.
881,Exicon,Big O,"Sit on the very edge of a skate bowl or any ledge with your legs hanging over the abyss, feet together. Make big O's with your feet, bringing them down into the bowl on the downswing. Hands out to the side or gripping ledge."
882,Exicon,Bill Murray,"Same as Sheldon Cooper, but instead of decreasing reps after each run, you do 10 merkins, 10 squats, 10 BBSU, and 10 burpees each time. After the 3rd or 4th round, one of the PAX said he felt like he was in 'Groundhog Day.' That is what led us to Bill Murray for the name."
883,Exicon,Billy Madison,"Inspired by Billy Madison's journey through back through school, this routine involves a running loop and exercise per grade.  For best effects, perform routine on school grounds. Begin with a loop (ideally single-file line leader style) to simulate the grade, followed by an exercise with 12 reps as the exam.  This concludes 1st grade.  Run the loop again, followed by the 1st grade exercise x 12 reps plus a new exercise x 12 reps.  This concludes 2nd grade. Continue with the loop and adding an exercise each time until you've completed one loop and exercise combo for each of the 12 grades.  Great for mumble chatter and telling of high school victories.  Celebrate graduation with snack packs for all!"
884,Exicon,Billy Run,"An AYG run performed during the last few hundred yards of what ought to be fellowship pace back to the parking lot at the end of a workout, initiated by one of the PAX when the spirit leads."
885,Exicon,Birthbees,"An exercise in salute to our mothers who went into double-time pain that we might have breath. The exercise consists of 8 movements to equal one completion of a birthbee. Thus, 2 Dollys + 2 Big Boy Sit-Ups (here’s to cramping) + 2 “nursing” nipple scrappers (cause you need to give attention to both sides) + 1 burpee jump up + 1 squat = 1. Completed in rounds of ten with a determined distance to run between reps: ex. at a hill where 10 are completed at bottom and then 10 at top until one’s age is reached in reps. Born at Hoffa Hill on 12/3/20 with F3 Wheaton @ AO Mastodon."
886,Exicon,Bizarro,"Bizzaro is Superman's Doppelganger (aka the ""negative Superman""), from DC comics. The exercise involves pulsing in and out of the Superman position over the lip of a skate bowl/pool (picnic table, ledge, whatever) so that the legs actually go negative."
887,Exicon,Black Jack,"Start on the sideline of a football field. Perform 1 Merkin - run to other sideline - perform 20 LBCs. Run back and do 2 Merkins. Run back for 19 LBCs. Repeat until you do 20 Merkins and 1 LBC, running between the sidelines. Always adds up to 21 - BLACK JACK!"
888,Exicon,Black Snake,"Take an Indian Run, but the last guy has to weave his way through the Pax to the front of the line."
889,Exicon,Blades of Steel,"Start in plank position with hands directly under shoulders, keeping arms as straight as possible. Slowly perform merkin with only your shoulders doing the movement, no bend in your elbows. At your lowest position your shoulder blades are close together, with elbows and back still straight. Slowly raise your body with only your shoulder blades pushing away from your spine. Your shoulder blades will be slightly rounded at top once complete. Suggested to move slow."
890,Exicon,Blart,"Similar to an Al Gore, Pax are in Air Chair position and grab the handlebars of their Segway. Pax bend at the knees - left, forward, right, back is 1 count (Kodiak style)"
892,Exicon,Blimps,"5 burpees, 10 lunge each leg, 15 imperial walker, 20 merkins, 25 plank jacks, 30 squats. Rinse and repeat as needed. Can be done to cross a field or lot."
893,Exicon,Block a Dock,Where applicable with a loading dock. Place Cinder block at your feet close to the dock. Pickup the block set it on the dock and put it back down.
894,Exicon,Block Burners,Best done with 12x12 Deck Blocks. Push deck block across a parking lot for about 40 yards. Do 11 Big boys with block. Push block back to start and do 1 Incline Merkin on the block. Repeat but drop 1 big boy each trip and add 1 merkin until you hit 13.
895,Exicon,Block Webbs,A Jack Webb using a concrete block incline merkin & a block press instead of an air press.
896,Exicon,Blockee,Burpees with cinder blocks. With your cinder block drop down and do a Merkin on the cinder block. Return to the standing position and press the cinder block above your head to complete one rep.
897,Exicon,"Blockee Balboa 1,2,3","The fearless and determined cousin of Lazy Dora 1,2,3. This variant includes coupons and jump ropes.  Partners will complete 100 Blockees, 200 American Hammers (with coupon), and 300 squats (with coupon) as a team. Partner 1 will start by completing 10 blockees while P2 is jumping rope, Flapjack every 10 reps till 100 are completed. Partners will then complete 200 American Hammers. One partner will do the reps while the other partner is jumping rope, switching at every 20 reps. Finally partners will complete 300 weighted squats.  One partner is doing the reps and the other partner is jumping rope, switching at every 30 weighted squats. This was originally Q'ed by Tech Deck to commemorate his 100th post in F3 Gold Rush!"
898,Exicon,Blocko,Blockee without the overhead press. Finishing position is coupon racked at chest level.
899,Exicon,Blockorama,"A #Routine done with concrete blocks.  Invented by some ancient Greek probably, but popularized @TangoDelta, who is kinda sorta a modern-day Greek."
900,Exicon,Blocktanamo,"PAX, in a circle, hold standard 8x8x16 concrete blocks straight out in front of them while one PAX sets down his block to run inside the circle pressing down on the others blocks. The next PAX sets his block down as soon as the guy next to him is on the move. Ends when the final PAX completes his lap. Works both clockwise and counterclockwise. A modified version of a PAX favorite, Guantanamo."
901,Exicon,Bloody Mary,"Begin in a situp (WWII) position with Cindy on your chest.  Sit up with the block, perform an overhead press, bring the block back down, and lay back down for one rep.  Can be done in usual 4-count cadence.  So named for the condition of your tailbone after many reps..."
902,Exicon,Blue Falcon,Pax is divided into two teams teams have 30 sec to come up with a plan then each team has 3 min (how ever log Q decided) to do their own workout at the end of the workout you trade workouts and the other team has 3 min to complete the other teams workout. This can be done single or multiple rounds at the end of each round loser has a punishment (20 burpees) or something like that if both teams complete the excersies it can be a tie. Or since this is America first one to complete others workout plan wins.
903,Exicon,Boat / Canoe,The Boat position would be while on six with legs pulled up to chest and arms beside body. Canoe is when legs and back are straightened while keeping both off the ground. Q calls out Boat or Canoe.
904,Exicon,Bob The Builder,"relay race between teams of 3 pax.  Each pax has two coupons that he must run individually 100 yds and drop.  Then runs back and tags next guy.  Race continues until all coupons ate placed 100 yds away.  But the Bobs wife realizes she doesnt want to build there, so now you have to run and bring each coupon back individually, race continues until all coupons are back."
905,Exicon,Bobby Hurley,"When one does a squat and slaps the ground with both hands like a Duke basketball player, then jumps up and raising arms as if taking a jump shot."
906,Exicon,Bodies Hit the Floor,"This is done to the song Bodies by Drowning Pool (3:21). Start in plank position. When the song says ""Let The Bodies Hit The Floor"" do a Donkey Kick (26 Total). When the song counts (1, 2, 3, 4) do a Merkin (21 Total). Always plank when not doing Donkey Kicks or Merkins and never let your Bodies Hit The Floor."
907,Exicon,Body Bag Builders,"This is a 10-count exercise. Perform 8-ct Body Builder but *insert 2-ct (right knee/left knee) Mountain Climber* after 2-ct Plank Jack but before 2-ct Merkin portion...'voila'...""8-ct Body Builder"" but worse; hence, the body bag reference."
908,Exicon,Body Builders,"Essentially this is an 8 count Burpee, with a plank-jack added. (1) Squat down, (2) legs out, (3) down part of Merkin, (4) up part of Merkin, (5) out part of plank-jack, (6) in part of plank-jack, (7) feet to hands, and (8) stand up. Extra credit (and why wouldn't we?) is to jump and clap overhead."
909,Exicon,Bohemian rhapsody,Slow Freddy Mercury with a 5 second hold on each side each side single count finishing with Freddy Mercury’s IC
911,Exicon,Bojangles Biscuit,"On a typical 400 meter track, sprint straights and mosey corners, each lap can add 10 blueberries (burpees) if want a blueberry biscuit"
912,Exicon,Bolt 45s,As in Usain Bolt Olympic runner. The Colt 45s of legs. Begin with 15 squats full standing position down to halfway position and return. Then go from halfway down position to full squat position and return up to halfway position 15x. Finish off with 15 full squats or jump squats.
913,Exicon,"BOMBS ""My arms and legs hurt""",Full UE LE Cardio workout
914,Exicon,Bone The Fish,"Find a parking lot with spaces ""facing"" each other and without concrete ""stops"". Start on the first set of lines by shuffle right, sprint up to the next line, shuffle left. Rinse and repeat for 4 lines then switch to karaoke for 4 lines, then back pedal/sprint for 4 lines. Repeat a few times to get the blood flowing"
915,Exicon,Bonkies,Burpee with a donkey kick
916,Exicon,Bonnie Blairs,"Jumping Lunges. Yes, it's really that simple."
917,Exicon,Boo Boo Bear Crawl,Similar to Bear Crawl but with either leg held off the ground all the time so the back leg has to basically hop forward.
918,Exicon,Booyah! Merkin,"In honor of the late great Stuart Scott, who no doubt would have been an F3 Dash pax, had F3 been in Chapel HIll decades ago. 2 pax plank facing each other perform merkin in unison and on up move reach out and tap right hand to partner's left shoulder, repeat merkin in unison with left hand tap to partner's shoulder to complete one rep. Each up move accompanied by a spirited BOOYAH!"
919,Exicon,BOPO,"Burpee, One-Legged Burpee, Plank Jack, One-Legged Burpee (other leg) - call this OYO for 10 reps."
920,Exicon,BOPOvators,"BOPOs and motivators combined.  Start with determined number of the Q's choice such as 5.  Begins with that number of SSH, half arm motion SSH, just leg SSH, and hop.  Perform 1 BOPO at the end of every round of Motivators before starting the descending reps of the next round."
921,Exicon,Bottom Feeders,"Any set of exercises where the pax travel back and forth and the traveling portion is limited to bear crawls, crab walks or other height-restricted method. (The exercises on either end do not need to be ground-based) - Examples: 7s 11s, 21s, suicides, pyramids, etc..."
922,Exicon,Boxcutter,"AKA Upstate Boxcutter. This ab exercise starts on your 6 with legs together 6 inches, out like a Dolly for 1, up for 2, back together for 3, and down without touching the ground for count. Can also be reversed from 6 inches, feet up together, feet out, down, back together at 6 inches for count. Feet are moving in a square motion."
923,Exicon,Breakdancer Merkin,"Begin in plank and perform the down part of a merkin. On the up, raise the right arm and come into a side plank, kicking your left leg in front of your body. Rotate back to plank and repeat on the other side. Can be done in (slow) cadence: 1) down; 2) right arm up, left leg through; 3) down; 4) left arm up, right leg through."
924,Exicon,Brian Shute,"PAX step up and down a bench, bleacher riser, step, etc. with a weighted mass (sandbag, coupon, etc.) about the shoulders.  An homage to Brian Shute's (Vision Quest) training regimen (climbing stadium bleachers with a telephone pole segment on his shoulders)."
925,Exicon,Brick Angels,"Best performed in cadence (6 count) with a high rep count, and using two bricks.  Start with arms down, at sides. Raise arms until straight out at sides (1) Bring bricks in to chest (2) Extend bricks straight up (3) Bring bricks back to chest (4) Extend arms back out to sides (5) Return to starting position for one rep."
926,Exicon,Brick by Brick Shuttlerun (BBBS),"BBBS – Brick by Brick Shuttle Run (Burpee Big Boy Sit-ups)  PAX number off 1s&2s and form two lines 10 yards apart (3 parking spaces at today’s AO). First PAX from Group 1 does the shuttle run by picking up a brick at the other groups line, returns brick to his line, then retrieves the second brick, then returns brick to his starting spot. Remaining PAX are meanwhile in plank position or crab hold awaiting their turn and rotate between the two positions. After PAX completes the shuttle run, he proceeds to perform:  R1: 15 Burpees, then falls in line in either plank or crab hold R2: 15 BBs, falls in line R3: 10 Burpees, fall in line R4: 10 BBs, fall in line R5: 5 Burpees, fall in line R6: 5 BBs, fall in line"
927,Exicon,Brickbarrow,"It's a wheelbarrow with 2 pax except the pax crawling on his hands also has to ""walk"" with a brick in each hand."
928,Exicon,Bricker,Any workout including predominant use of bricks/blocks as weight or resistance. Inspired by the third official workout of F3 Cleveland.
929,Exicon,Bridge of Hate,"The bridge of hate is the exact opposite of the tunnel of love. The pax form a line by laying on there back shoulder to shoulder. One pax will then be lifted and passed down the line of the pax that are laying on the ground. When the pax that was being passed down the line gets to the front he lays next to the last man and the man at the rear of the line then gets passed down, so forth and so on. Just like an inverted tunnel of love. Exercise can be done for distance or turns. Q's choice."
930,Exicon,Bridge over the Nest,"Both partners start at the base of a bridge or hill. Partner 1 starts bear crawling over the bridge while Partner 2 completes 10 squats, 10 merkins, and 10 LBCs. Partner 2 then runs to the opposite side of the bridge and then runs back to the bear crawling Partner 1. Partner 2 picks up with the bear crawl while Partner 1 runs to the start to complete the exercises, runs across to the other side, and runs back to Partner 2. Repeato back and forth across the bridge until time runs out or the PAX start a mutiny against the Q for excessive cardio. Swap bear crawls for lunges, crab walks, inch worms, etc. after each round as desired."
931,Exicon,Broad Jump Burpee,Combination of burpee with a broad jump forward at end of burpee.
932,Exicon,Brodie Lee,Front Kick to Walking Lunge
934,Exicon,Broken Wheelbarrow,"Similar to a wheelbarrow. Partner one walking on ground with hands while partner two is holding only one leg, with the other leg free of held leg. This demands dramatically more core stability. This has been referred to as the Broken Spirit."
935,Exicon,Bropee,Performing a burpee with a partner simultaneously so that on your squat jump up you execute a most excellent high ten.
936,Exicon,Bruce Lee,"An super set consisting of 6 ab exercises: 1. Hammer, 2. Leg raises, 3. LBC's, 4. Heel Touches, 5. Crunchy Frog, 6. 100's. 20 reps, 3 sets. 30 seconds rest between each set. work up to 90 reps, 7 sets: Bruce Lee's work out."
937,Exicon,Bucket Brigade,"Works best with 4 - 8 men. Line up at top of stairs (or large hill). One man on each stair shoulder-to-shoulder. Man on highest stair passes heavy object (i.e. 60lb sandbag, cinderblock, etc) down to next man, who passes it along the line. Once you hand off object, run down stairs to end of the line to receive object again. Once at bottom of stairs, repeat going back up."
938,Exicon,Bucket Brigade Lunge,"With Rock or other coupon in hand, backwards lunge and twist towards front leg. Alternate legs and direction...like in a bucket brigade."
939,Exicon,Bulgarian Squats,AKA Bulgarian Split Squats - a version of a single-leg squat where the back leg is elevated such as on a bench or another guy's back
940,Exicon,Burp & Groin,"Like the Burp & Merk, but do ascending Groiners 1-10 after the merkin part of the burpee."
941,Exicon,Burp & Merk,"Begin a traditional burpee with a single push up at the bottom, then complete. Drop back down for a second burpee with two push ups, then complete. Pyramid up to 5 if you’re a girl or 10 if you’re a man, pyramid all the way back down to one if you’re an F3 Man!! Hooah!"
942,Exicon,Burp Back Mountain,"A punishing full body exercise begins by locating a nice-sized hill. The exercise is then performed by pairing up with one person proceeding to run backward up the hill/forward down the hill 5X while the other person is performing burpees. The individuals continue to alternate running with burpees until 100 total burpees are completed. When finished, pax continue to run hills until entire pax completes."
943,Exicon,Burpee,"A multi-step, full-body exercise in which you move from standing to push-up to squat to jump. Best seen in F3 TV example."
944,Exicon,Burpee Dans,"This exercise is OYO. Line up across field/parking lot. Perform 1 Burpee : 4 lunges forward until you reach other side of parking lot. Turn around, perform 2 burpees : 4 lunges back to starting position. Rinse and repeat as necessary increasing burpees by 1. Pick up the six or plank until all PAX finish."
945,Exicon,Burpee Mile,"48 burpees, 1 mile run. Done as 12 burpees, run 1/4 mile x 4."
946,Exicon,Burpo,"A low burpee. Starting position is bottom of a squat. Then reach hands out to ground, legs fire back into a plank, chest to the ground, pushup, draw legs back into a squat, final position is the bottom of a squat. No standing up for the duration of the reps."
947,Exicon,Burp-ups,"Standard Burpee done (typically under monkey bars) where you do the Burpee, then when you jump you grab the monkey bar and go straight into a pull up. Rinse repeat."
948,Exicon,Butkus,"Consists of rapid step ups on a curb for at least a minute, then 30 second rest, then another minute, etc. (like rounds of boxing…how many rounds the Q wants to bring it). At least 3, with a ""Ding, ding"""
949,Exicon,C2C,"Short for Corner to Corner, running short, fast distances to a corner or designated spot, where the #SugarRays pick up a plank to wait for the #Six."
950,Exicon,Cadence,"Aka In Cadence. Exercises done on command of the Q, in rhythm. Example is Q shouting ""1, 2, 3, 1"" as a four-count cadence."
951,Exicon,Capri Lap,"Usually a warmup lap around the parking lot or AO staying close enough to be seen by any that arrive late, but can include and or all of the the warmup. Named this in honor of Mint Hill's Capri who seems to always be a minute or two late."
952,Exicon,Captain Morgan,In plank position raise on one side and bring the high side knee up. Like Captain Morgan.
953,Exicon,Captain Therkin,"Captain Thor modified with 5 merkins between each set. 1:4, 5x merkin, 2:8, 5x merkin, 3:12, 5x merkin, etc."
954,Exicon,Captain Thor,An ab exercise done in a 1:4 ratio. 1 big boy sit up to 4 American Hammers (Russian Twist). Try to get 10:40 before Merlot comes.
955,Exicon,Carioca,"Running while crossing left foot over right and twisting at the hips, reverse - like the DBs do in the NFL. Often mistaken for Karaoke."
956,Exicon,Carolina Dry Docks,"Modified push-up. Bend only your elbows, allowing body to drop head toward hands without lowering your six."
957,Exicon,Carolina Pyrkins,"Perform Werkin. Shift to pike position, then perform a wide ""pyramid-like"" Carolina Drydock."
958,Exicon,Catalina Wine Mixer,"Starting in plank position, go down onto each arm into a chilcutt. Last arm down becomes the first one to go back up into a plank. Then do a merkin. That's 1."
959,Exicon,Catch Me If You Can,"Two partners. Partner 1 performs 5 Burpees (or 10 Diamond Merkins or X Number of Whatever the Q says), and then sprints to catch the Partner 2, who has been running backwards. Repeato until Q says stop or track lap is complete."
960,Exicon,Catch Us If You Can,"Three partners. Partner A partner carries Partner B. Partner C performs 5 Burpees (or 10 Diamond Merkins or X Number of Whatever the Q says), and then sprints to catch the pair. Partner C then partner carries Partner A. Partner B performs the called number of the called exercise and then sprints to catch the pair. Partner B then partner carries Partner C. Partner A performs the called number of the called exercise and then sprints to catch the pair. Repeato."
961,Exicon,Caterpillar,"PAX forms 2 lines face-to-face, down in plank position. Allow 2-3 feet between PAX. Last man box-jumps over the planking PAX to the head of the line, Indian Run style. Continue cycling through over a Q-prescribed distance or until toasted."
962,Exicon,Charles Bronson,"Start with 3 shovel flags, cones or other distance markers with first two 100 yards apart in a line, the last another 10-30 yards past. At starting point, perform 50 SSH's, sprint to 2nd point, then army crawl or bear crawl to 3rd point. Mosey back to start, 50 Merkins then rinse/repeat. 50 burpees, rinse/repeat. 50 LBC's, rinse/repeat. Finish with 50 Jump Squats rinse/repeat. Coupons optional. NOTE: a white board at start with exercises listed is invaluable."
963,Exicon,Cheerleader,"Start in SSH position, go to the up SSH position, on the down go into a squat and bring hands to a point below the knees and repeat. Can be called IC or OYO."
964,Exicon,Cheerleader Merkin,"Needed: odd count of pax (example below is with 5 pax) and a raised surface (bench, bleacher, etc) 3 pax in plank side by side 2 pax on top (with feet on bench and hands on back of 2 pax below) to form pyramid  10 abyss merkins for pax on top and everyone rotates clockwise until rotation is complete"
965,Exicon,CHerkin,"Like a merkin or carolina dry dock but you lower your body slowly to touch your forehead to the ground. ""CH"" refers to ""Cheesehead"". (Thanks Carrier in CLT Metro.)"
966,Exicon,Chicken Peckers,"Feet up on the Wall, Hands on the ground. IC lift your hand and touch your opposite shoulder."
