id,Category,_Term,Description
1138,Exicon,Four Ladies,"A good routine for classic rock lovers.  Mosey a lap around the field after each lady.  Lady 1) Squats to “Flower” by Moby. When Sally is up, we are up, when Sally is down we are down.   Lady 2) High plank hold with a Merkin every “Roxanne” during the namesake song by Sting and the Police.   Lady 3) SSH to the beat of “Sharona” by The Knack and burpee every time we hear Sharona’s name.  Our next inspiration came from trying to forget about Mary with  Lady 4) Flutter kicks to the beat of “Help me Rhonda” by The Beach Boys, where a v-up is performed every time Rhonda is mentioned. "
1139,Exicon,Foxhole,"2 for 1 value exercise! Its a WWI, roll to the side into a Merken. Repeato."
1140,Exicon,FrankenSteinl,"The Steinl, only the routine is performed while wearing a Ruck sack or vest."
1141,Exicon,Frankensteins,"Stand with Arms straight out. As you walk forward, raise each leg as high as you can toward corresponding arm. Knees slightly bent. Looks like Frankenstein."
1142,Exicon,Freak Nasty,"A side plank dip.  Get in a side plank position with your right hand and the side of your right foot touching the ground. Hold your core tight and dip your hips below then above your starting position. Switch and repeat on the opposite side because when I dip, you dip, we dip."
1143,Exicon,Freddie Mercury,Aka the bicycle sit-up. Alternate extending legs and arms in a bicycling motion during the sit-up.
1144,Exicon,Fruit Roll Up,"A relative of the LBCs, this pairs well with dips, box jumps, or Bulgarian squats on a low ledge. Strap your feet on top of the ledge. Perform a sit-up and touch your toes."
1145,Exicon,Gas Pump,Start in the LBC position and straighten your legs to the Dolly position and then back to the LBC position. Sit next to @Mungo in the Lake Murray region when he does these and you'll know where the name comes from.
1146,Exicon,Gas Station Male Enhancement,"Quick back story - a new AO was named ""Iron Horse"" without realizing the connection to the over the counter  gas station viagra...   Q calls the ""GSME""  and proceeds to call 10 Getups civilian cadence, 10 Squats IC, 10 Merkins IC, and lastly 10 Evil Monkey Humpers IC.  Rinse and Repeat.  The evil monkey humper is a variant of the standard monkey humper that adds a ""hop"" when PAX call out the count.  ""1, 2, 3, 'hop'"""
1147,Exicon,Get Low,"Performed to the song Get Low by DJ Snake, hold the people's chair while the song says Get Low over and over again. When the Beat Drops do squats up and down in Cadence with the beat. The song will repeat and you can either repeat this or you can drop to a low plank. Hold the low point of a merkin while the song says Get Low for what seems like a ridiculously Long Time. When the Beat Drops do merkins, if you can. Good warm up to a ridiculous song"
1148,Exicon,Get Low or Buried Face,"Merkin/pushup position, feet are raised onto a bench (2.5ft or higher elevation if prefered). While in pushup position w/feet elevated together, each hand is placed on a cinder-block/brick, allowing push-ups to have a lower range to dip and push back up from. Since the head now parallels the hands, the pectorals get a better stretch, as well as the arms & shoulders, since the head & body now fall below the level of a typical face-to-ground push-up."
1149,Exicon,Get Lucky or not so much,"Listen to ""Get Lucky"" by Daft Punk, and every time they say ""get lucky"" do a merkin. Everytime the song says ""we're up all night"" hold an Al Gore until he says ""get lucky"" again."
1150,Exicon,Glen Campbells,"https://www.youtube.com/watch?v=R4kPQSKGJqA Another name for Partner Carries, but Partner Carry is too simplistic a name for a dignified, musically well rounded PAX. 70's Gold. The lyrics and angelic voice say it all."
1152,Exicon,Good Morning Abby,"Starting position laying on your back, sit upright at the same time bending your legs and planting your feet then stand upright not using hands for support. Lower back down to a sitting position and extend legs while laying back down to complete one round. Originally called prisoner get ups but we like good morning Abby better."
1153,Exicon,Good Morning Burpees,"While moseying you must say ""good morning"" to everyone you pass. If they reply ""good morning"" then the pax stop and perform 5 burpees then continue on your way. Bonus points if the person who replies to the pax performs the burpees also."
1154,Exicon,Goof Balls,imaginary ladder climb. Starting position is hands at eye level. 4 count cadence. 1) extend right arm in air and high knee with left leg. 2) return arm and leg to regular position 3) left arm extended and high knee with right leg. 4) return arm and leg to regular position. Recommend 20 4 counts
1155,Exicon,Goofball,A standing mountain climber (running in place) while you alternate your arms up and down (like climbing a ladder). Do it in cadence x 20. Call it goofball b/c you look exactly like one when doing this. Good exercise for the warmup.
1156,Exicon,Google Bun Shaper,Walking Lunge and extend back leg at a slight angle to align with the glute muscle fibers. Make sure to squeeze and focus on the glute you are raising.
1157,Exicon,Gorilla Complex,"With a cinder block or other coupon of Q's choosing, PAX perform the following OYO without stop: 8 Curls For Girls, 8 High Pulls, 8 Overhead Presses, 8 Tricep Extensions, then drop coupon for 8 Merkins. Follow this up by a quick mosey for a brief upper body recovery, typically no more than 50 yards. Rinse and Repeat 8 Times."
1158,Exicon,Gorilla Humpers,"Like Monkey Humpers, only bigger! Stand with feet much wider than shoulder width, half-squat performed while grabbing the inside of your ankles. Still gets all of the burn, but it's significantly different than your normal monkey hump."
1159,Exicon,Grady Corn,"In memory of Grady Pitstick, aka ""Quikrete"", who passed away a year ago.  He was only 30 years old, and the son of another member of the Knoxville PAX, Brian Pitstick, aka ""Sparkler"".   ""Grady Corn"" is a a combination of Grady's name and ""Candy Corn"", which was an exercise Grady brought to us that became his trademark.  It is a shoulder warm up that can become a full-on exercise with enough reps.  Here is its description: Four-count exercise that  begins in a standing position with your arms together, straight out in front of you.  Swing your arms back to a ""T"" formation, then over your head to form a triangle, then back down to a ""T"", and then back to the starting position.  25 reps makes for a good shoulder warm up.  At 50 reps the mumblechatter starts to dwindle.  Groans of pain begin at about rep 75,  which should be taken by the Q as encouragement to keep going to 100."
1160,Exicon,Grave Diggers,Coupon exercise. Start standing with feet shoulder width apart and straddling a coupon. Bend over and grap coupon and lift it up and over the right shoulder until the coupon is by your right ear. Then return the coupon between your feet. Repeat on left side. This is easily completed as a 4-count exercise.
1161,Exicon,Green Sally Up,"Q plays the song ""Flower"" by Moby (Gone in 60 seconds soundtrack). Start with your chest on the ground, and enjoy it because your chest shouldn't touch the ground again until the song is over. When the song says ""Green Sally Up"" the Pax will be in the 'Merican up position, and ""Green Sally Down"" the Pax will be in the 'Merican down position. Pax will hold the down position until the next rep. It's only 31 little reps in 3:30. Scale this workout to your fitness level: If you are fatigued, modify the 'mericans by either doing chest to ground at the bottom, or take no shame and use your knees. Here's a tip to complete it, position hands between shoulders and chest and close to the body, much less stress on the shoulders. This can be modified to about any move; squats, curls, planks or even pull-ups if you are absolutely insane. http://www.youtube.com/watch?v=6A2V9Bu80J4"
1162,Exicon,Greg Louganis Merkin,"From plank position, do a merkin then shoot your legs up and through your arms while flipping over backwards arriving in plank position. Don't hit your head."
1163,Exicon,Greta 1-2-3,"Dora's Icelandic Cousin...she's frigid. It's like Dora 1-2-3 but performed with each exercise using a 30lb cinderblock (YHC used Kettle bell swings, squat to overhead press, and block burpees) . Also, while one of the pair is running, the runner is carrying another cinderblock to leave at the top of the run for the other to carry back. All the while the runner has to hurdle over three obstacles (hay bales). It's terrible and horrible combined."
1164,Exicon,Griff,Run 800m; Run 400m backwards; Run 800m; Run 400m backwards. Griff is a Crossfit Hero.
1165,Exicon,"Grip, Rip, and Roll (GRRs)","Sitting up on your six, set a cinder block by your side. Grip the cinder block. Pick it up and place it on the other side of your body. Now place your hands on top of the cinder block, roll into a plank on top of the block, then roll to the ground. Repeato movements until the PAX start to complain."
1166,Exicon,Grizzcalator,Merkins Crawls up or down (is much harder) the stairs: Ascend/Descend the stairs one at a time in plank position. Perform a merkin on each stair.
1167,Exicon,Groiner Jacks,4-Count exercise- Groiner + plank jack
1168,Exicon,Groiners,"Starting from a pushup/merkin position, thrust your feet forward, landing outside of each hand. Thrust backwards to original position. Repeato."
1169,Exicon,Ground Pounder,"Starting position - holding large rock up near chest. On 1: Lift Rock over head, On 2: bring rock back to chest, On 3: bring rock down to pound the ground in a deep squat then return to starting position."
1170,Exicon,Growing Pains,"An abs routine that consists of three exercises done with iterations of 30 in cadence or on the Q's count, each getting more ""mature."" Start off with 30 LBCs (preferably 4-count, in cadence), immediately move into 30 Big Boys, then immediately into the Superman position while the Q counts off 30 seconds (can be done in a 4 count with the PAX). Developed for Marvel's 30th Birthday Q."
1171,Exicon,Guantanamo,Pax in a circle on their backs heels up. First pax jumps up and pushes the feet down around the circle fighting to keep legs off the ground. Followed by next pax in line then hit the ground legs up when back to your start position until last man finishes the circle.
1172,Exicon,Gunners,"The PAX completes a set of exercises in succession of the process of the firing of a gun.  Hammer, to explosion, to barrel path PAX lines up in a across an open field on their Six. Complete a number of American Hammers and explosive exercise (eg. Burpees, Jump Squats) as set by the Q  AYG Sprint to a point set by the Q Repeat Exercise pattern again."
1173,Exicon,Gunpowder Plot,"All PAX line up on one side of a parking lot, 11 of one exercise, hold relevant position for the six (arms = plank, legs = al gore, abs = six inches); sprint to next parking line, 5 of a different, more intense exercise, hold relevant position for the six, sprint to next line, rinse/repeat all the way across. PAX may revolt depending on the size of the parking lot. Named for the November 5th “Gunpowder Plot” of 1605 referenced in the movie V for Vendetta."
1174,Exicon,Gut Busters,Everyone starts in and holds a plank during the Ghostbusters song. Every time they say “Ghost Busters” you complete a burpee. In the “I ain’t afraid of no ghosts” sections do plank jacks in rhythm. Bustin’ makes everyone feel good!!!! 
1175,Exicon,Gwerkin,"Modified ""Squerkin."" Instead of holding partner's legs at side, hold partner's feet together in ""goblet squat"" position, or put partner's feet on your shoulders."
1176,Exicon,Hail Mary,"Partner up, near picnic table or other such object. First man planking on ground, second man with his legs on first back doing dips with his hands on picnic table. flapjack after each set."
1177,Exicon,Hair Burners,"To push weight plates (10s, 25s, 35s or 45s) across the ground in a parking lot or around a track for a given time or distance. An Area 51 Tiger Rag special."
1178,Exicon,Hairband Mile,A Mental Marathon with an Actual Run or Jogging Distance equal to or less than 1/4 mile. Named in honor of Hairband who claims to hate running but is secretly a closet runner.
1179,Exicon,Hairy Rockettes,"Often called the alternating toe touch, PAX will start by standing with feet at shoulder width with arms extended out to sides. With a four count cadence, exercise will start by bringing right foot up to left hand for count 1 with leg kept as straight as possible. Return right foot to ground for count 2, followed by left foot to right hand for count 3. Return left foot to ground to complete count."
1180,Exicon,Hallelujahs,Have hands raised during any or all exercises...(creates a Major Burn..)
1181,Exicon,Halo,Hold coupon in both hands while standing. Maneuver it around your head. Each time you circle your head look through the opening (if cinder block). Then change directions.
1182,Exicon,Hand Release Prisoner Cell Merkin Burpees aka HRPCMBs,"Same as PCMBs except the Merkins are replaced with Hand Release Merkins. Drop to Plank, do 1 Hand Release Merkin then bring your right knee in and back, do 1 Hand Release Merkin then bring your left knee in and back, do 1 Hand Release Merkin then bring both feet in and jump up = 1 HRPCMB complete. You think PCMBs are bad? Wait until you try these."
1183,Exicon,Hands of Time,"Close COP with PAX on their 6's, heads in the center with legs out. (as though forming a clock). Q starts the PAX, legs up at 90 degrees, hands under your rear. One PAX at a time in a wave like motion- Each PAX counts off aloud as they drop and hold 1,2,3, etc around the circle until finished (suggested 60,120,180,240). Drop straightened legs to 10 degrees and hold until a full revolution has been made (as the second hands would move around a clock) then return to 90 degrees and repeat until smoked! Alternate version... MICKEY'S Hands of Time, similar to above but with a partner standing over the PAX on the ground and ""Throwing down"" their legs to the left or right instead or straight forward. Do not let the legs touch the ground during the exercise!"
1184,Exicon,Hanging Toe Touch,Hanging from monkey bars facing crossways of bars. Normally hanging from a bar in each hand. Swing feet up to touch opposite side of monkey bars.
1185,Exicon,Happy Jacks,"Do 5 side straddle hops in cadence then after the 5th one everyone does two jump squats. Like this... Side Straddle Hops IC: One, two, three, ONE! One, two, three, TWO! One, two, three, THREE! One, two, three, FOUR! One, two, three, FIVE! Quickly followed by two jump squats. Repeat 4x or until no one can breathe."
1186,Exicon,Hard Knock Annie,"This is like an Annie, but only if her rag is a cinder block. Begin in a merkin position with a coupon to your right side, even with your chest. Perform one merkin. Reach under your body with your left arm and drag the coupon to your left side. Perform another Merkin. Reach under your body with your right arm and drag the coupon to your right side. Great core workout and works those back muscles as you pull the coupon indeed you."
1187,Exicon,Harley Quinn's,"Harley Quinn's, Margot Robbie's character in Suicide Squad, are a spin-off of classic suicides and performed on a football field or any field with set distances or cones. Two exercises are needed each round, Exercise A is performed on yardage that starts with odd number and Exercise B on yardage that starts with even number). Rounds consist of PAX starting on the end line, PAX run to the 10yd line, perform 10 reps of Exercise A, run back to baseline, Run to 20yd line and perform 20 reps of Exercise B, run back to baseline, 30yd= 30reps Ex A and so forth. (Yardage marker equals number of reps performed. Can do this down whole field or to set distance and back. (ie. 10,20,30,40,30,20,10) *For full football field, the opposite goal line = 10reps to ensure even count between the two exercises. Exercises can change after complete set is done. (ie. only going 40yd out and back). Harley Quinn's are best performed with a group!"
1188,Exicon,Harry Nilsson,"Start in flutter kick position, then play ""(Put the Lime in the) Coconut"". When Harry sings the word ""lime"", do a lemon squeezer (do a sit up while bringing your knees toward your chest until you tap the outside of your ankles with your hands). Before the song is over the PAX will also be asking if there's something ""to relieve this bellyache""."
1189,Exicon,Hash Pipe,"Purchased 10 iron pipes, 3/4"" x 30"", at Home Depot. Duck taped caps on the end. PAX1 takes a balanced straddle stance over PAX2 who is laying on his back. PAX1 is holding a 36"" iron pipe horizontally at upper thigh height. Arms straight, back arched, similar to a water skiing posture. PAX 2 reaches up and grabs a shoulder-width grip on the pipe and executes a reverse push-up. (Pull-up) After 20 reps you flapjack. We have also used the pipes for resistant curls. PAX1 Curls for the Girls, PAX2 pushes down on pipe."
1190,Exicon,Hatching Butterfly,"From the seated position place the bottom of your feet together as you would do if performing the butterfly stretch. Raise hands directly over your head, lay back as if performing a WWII sit-up and return to the starting position with hands over your head."
1191,Exicon,"Head and Shoulders, Knees and Toes","Raise and lower coupon to four different positions as Q sings or calls this exercise. 1. Head: hold the block in front of your face. 2. Shoulders: hold block at shoulder height 3. Knees: hold block at knee height. 4. Toes: hold block as low as you can get it without touching the ground. If you want to include “eyes, ears, mouth, nose”, hold block in front of head while making small movements up and down.  Repeat the song about 4 times."
1192,Exicon,"Head, Shoulders, Knees & Toes","Start with coupon on ground in front of you, feet shoulder width apart. 1) Deadlift coupon to thighs 2) Front Lateral Raise coupon, straight arms 3) Pull coupon, laterally, to chest 4) Press coupon overhead 5) Lower coupon behind your head, elbows pointing up 6) Extend coupon back over your head, keep elbows up 7) Lower coupon to chest 8) Extend coupon out laterally from chest, until arms straight 9) Lower coupon to thighs, arms straight 10) Lower coupon to ground, via reverse deadlift. That’s 1 rep. 15’ll hurt so make’em do 20!  Can be done in a group with a 10-count cadence or OYO. The PAX will never listen to the kid’s classic the same again."
1193,Exicon,"Heartbreak 1, 2, 3s","Heartbreak 1, 2, 3’s are modified Dora 1, 2, 3’s with a heartbreaking hill in place of the 100 meter sprint–a la the final soul-crushing hill in the Boston Marathon. Hill should be just steep enough that standing at the bottom looking up is enough to induce heartbreak when making that final run to the top. If you live in the flatlands, a very steep bridge abutment works just as well."
1194,Exicon,Heavy Freddies,Freddy Mercuries holding a rock/block 6 inches from the ground.
1195,Exicon,Heels to Heaven,"A traditional Mary exercise performed on the back.  Begin with heels up at 90 degrees.  Count cadence lowering the heels down to 6 inches, then thrust them back up to 90 degrees bringing your 6 off the pavement, thus shooting your heels to heaven."
1196,Exicon,Hernia,"The Hernia is a V-Up using a Coupon. Lying flat on your back, stretching arms above your head flat on the ground with coupon. Do a standard V-Up and bring coupon to toes in one motion. Careful to not hit shins. This works the full lower Abs, Lats, and triceps. Named after a Pax mentioned that it was going to cause a hernia!"
1197,Exicon,Hillbillies (or Hillbilly Walkers),Similar to Imperial Walkers but knee comes up to elbow on same side of body as side that knee is raised.
1198,Exicon,Hillbilly Squats,"Both hands behind your head, elbows out. Legs/feet set as in a sumo-squat ready position (feet slightly wider apart and pointed more outward than a normal LSS ready position). Initiate movement with a deep sumo squat, then transition to a hillbilly walker - after you thrust up you lift one knee up and side crunch the same side elbow down to where they both almost or lightly touch. Then place foot back down and straighten up from the side crunch. That's one rep. Repeat, alternating L-R sides as you go.  Could be called Sumo Hillbilly as well."
1199,Exicon,Hindenburg BLIMPS,"Modified version of BLIMPS. Done on a field. Perform exercise at corner #1, sprint to corner #2, perform exercise. Sprint to corner #3 perform exercise. Then to corner #4, exercise and then back to corner #1. Plank it up until all have finished. Thats one round. Round 1 - 10 Burpees; Round 2 - 20 Lunges; Round 3 - 30 Imperial Walkers; Round 4- 40 Merkins; Round 5 - 50 Plank Jacks; Round 6 - 60 Squats"
1200,Exicon,Hip Slapper,"Hands on the ground, feet on the wall, head and justifier facing the wall. Raise one hand and slap same side hip while balancing on other hand. Flapjack."
1201,Exicon,Holy Jacks,"A cousin of Jack Webbs, named after Holy Roller from F3 Louisville because he's a beast. The thang: 1 BOYO, 4 jump lunges. 2 BOYOS, 8 jump lunges. All the way up to 10 BOYOS, 40 jump lunges. This can also be done starting at the top of the ladder, starting with 10 BOYOS & 40 jump lunges then working your way down to 1 BOYO & 4 jump lunges, which is how it was done the first time in F3 Louisville on 4.9.2021."
1202,Exicon,Homer to Marge to Mr. Burns (also submitted as Homer-to-Marge Merry Relay),"As with much nomenclature in the Lake Norman area just north of Charlotte, we have a nuclear theme for this exercise. The Simpsons also lived within a 10 mile radius of a nuclear power plant where the potassium iodide pills only prolong the inevitible in the case of a meltdown. Homer is laying on your back and holding your feet 6 inches off the ground with your hands under your posterior. We raise our straight legs to vertical, which we call Marge (picture her hairdo) and then lower them on a 4 count to Homer. For an added twist (pun intended), from Marge, with your hands out to the side, lower your legs to the left and turn your head to the right for Mr. Burns (why? because it burns and he worked at the Springfield nuclear plant). Repeat on the other side. This can be done in cadence, slowly, quickly...mix it up!"
1203,Exicon,Hot Potato,"Pair up. Face each other. On your bums and lock ankles. Starting man grabs a paver or sandbag, tosses it over the head of his partner, then stays at 45 degrees. Partner catches the weight, falling to his back, touches the ground over his head with the weight , then performs a sit-up motion, tossing the weight back. Starting man performs the sit-up. Hit potato - get rid of that weight! / Perform for 90 seconds or as long as the Q has gas."
1204,Exicon,Howling Monkeys,"In a circle, everyone grabs their ankles in Monkey Humper fashion (or Gorilla Humper, for the fearless) . The first person does ten monkey humpers followed by the next person and so on as in other ""ring of fire"" exercises. Don't let go of the ankles! Depending on the number of PAX, two rounds seems to result in Howling Monkeys. This will definitely not be a crowd pleaser, and it might be better to not be seen by light of day in a public space."
1205,Exicon,HRBs,"Hand-release Burpees, aka Cross-fit Burpee."
1206,Exicon,Hundreds,Excercise position...on your 6. legs straight and at a 45 deg angle off the ground. head and shoulders off ground. arms straight and down by your side with palms facing ground. do quick 6 inch pulses with arms/hands until you reach 100.
1207,Exicon,HuRpee,Hand Release Merkin Burpee
1208,Exicon,Hurpees,Hand Releasing when going down to do a Burpee. Aka Hand-release burpees or HRRRPPes.
1209,Exicon,Hurricane Hoedown,"Flutter kick circuit performed in cadence: 7 IC Seated Flutter Kicks with hands raised in Hallelujahs. Move immediately to hands behind you. 7 IC slightly reclined flutterkicks. Move immediately to 7 IC normal flutter kicks. Move immediately to 7 IC LBC Flutter kicks. Rinse and repeat as needed. The real crowd pleaser is to work your way down the cadence ladder 7,6,5..."
1210,Exicon,Hydraulic Humper,"Added to a monkey humper or gorilla humper to increase the intensity of the burn in the legs. While at the nadir of the humper go down to the right knee, then the left knee, then back up in reverse, then complete the bumper."
1211,Exicon,Hydraulic Squat,"Begin by doing a squat, once in the squat position put your right knee on the ground followed by your left knee, next bring your right knee up followed by your left knee then stand up."
1212,Exicon,Ignore this,delete me
1213,Exicon,Imperial Blockers,"Standing, hold coupon in front at chin level (top of an arm curl). Lift your knee to the opposite arm's elbow"
1214,Exicon,Imperial Guard,Basically an imperial walker lunge walk. Right knee up with twist then lunches forward. Left knee up and twist and lunge forward. Continue until your destination or the PAX start whining. Then do one more.
1215,Exicon,Imperial Squat Walker,"Cruel cousin of the Imperial Walker. This 4-count exercise starts with hands clasp on head. Count 1 = a squat. Count 2 = stand up and bring one knee up to the opposite elbow. Count 3 = a squat. Count 4 = stand up, other knee to other elbow. Q should be mindful to count at a pace that allows/encourages a nice, deep squat. Rushing the count produces girly squats."
1216,Exicon,Imperial Stormkickers,Starts the same with arms behind the head. Bring the knees up and then extend for a front kick and back down. Then the other leg for a predetermined rep count. Basic front kick to be instructed but nothing too technical.
